"No.","Time","Source","Destination","Protocol","Length","Info"
"1","0.000000","2a03:90c0:5a1:2801::62","2401:4900:32b3:30df:159e:27ba:5143:dbb6","HTTP","1367","Continuation"
"2","0.000058","2401:4900:32b3:30df:159e:27ba:5143:dbb6","2a03:90c0:5a1:2801::62","TCP","86","40472  >  80 [ACK] Seq=1 Ack=1282 Win=210 Len=0 TSval=471866760 TSecr=3839641490"
"3","0.006734","2a03:90c0:5a1:2801::62","2401:4900:32b3:30df:159e:27ba:5143:dbb6","HTTP","1367","Continuation"
"4","0.006734","2a03:90c0:5a1:2801::62","2401:4900:32b3:30df:159e:27ba:5143:dbb6","HTTP","1367","Continuation"
"5","0.007144","2a03:90c0:5a1:2801::62","2401:4900:32b3:30df:159e:27ba:5143:dbb6","HTTP","1367","Continuation"
"6","0.007144","2a03:90c0:5a1:2801::62","2401:4900:32b3:30df:159e:27ba:5143:dbb6","HTTP","1367","Continuation"
"7","0.007144","2a03:90c0:5a1:2801::62","2401:4900:32b3:30df:159e:27ba:5143:dbb6","HTTP","1367","Continuation"
"8","0.007181","2401:4900:32b3:30df:159e:27ba:5143:dbb6","2a03:90c0:5a1:2801::62","TCP","86","40472  >  80 [ACK] Seq=1 Ack=3844 Win=210 Len=0 TSval=471866767 TSecr=3839641499"
"9","0.007197","2401:4900:32b3:30df:159e:27ba:5143:dbb6","2a03:90c0:5a1:2801::62","TCP","86","40473  >  80 [ACK] Seq=1 Ack=3844 Win=194 Len=0 TSval=471866767 TSecr=1306369275"
"10","0.009437","2a03:90c0:5a1:2801::62","2401:4900:32b3:30df:159e:27ba:5143:dbb6","HTTP","1367","Continuation"
"11","0.009490","2401:4900:32b3:30df:159e:27ba:5143:dbb6","2a03:90c0:5a1:2801::62","TCP","86","40473  >  80 [ACK] Seq=1 Ack=5125 Win=194 Len=0 TSval=471866769 TSecr=1306369278"
"12","0.010167","135.233.45.221","192.168.31.133","TCP","54","443  >  35223 [FIN, ACK] Seq=1 Ack=1 Win=16384 Len=0"
"13","0.010200","192.168.31.133","135.233.45.221","TCP","54","35223  >  443 [ACK] Seq=1 Ack=2 Win=252 Len=0"
"14","0.031548","2a03:90c0:5a1:2801::62","2401:4900:32b3:30df:159e:27ba:5143:dbb6","HTTP","1367","Continuation"
"15","0.031548","2a03:90c0:5a1:2801::62","2401:4900:32b3:30df:159e:27ba:5143:dbb6","HTTP","1367","Continuation"
"16","0.031916","2a03:90c0:5a1:2801::62","2401:4900:32b3:30df:159e:27ba:5143:dbb6","HTTP","1367","Continuation"
"17","0.031916","2a03:90c0:5a1:2801::62","2401:4900:32b3:30df:159e:27ba:5143:dbb6","HTTP","1367","Continuation"
"18","0.031974","2401:4900:32b3:30df:159e:27ba:5143:dbb6","2a03:90c0:5a1:2801::62","TCP","86","40472  >  80 [ACK] Seq=1 Ack=7687 Win=210 Len=0 TSval=471866792 TSecr=3839641508"
"19","0.032002","2a03:90c0:5a1:2801::62","2401:4900:32b3:30df:159e:27ba:5143:dbb6","HTTP","1367","Continuation"
"20","0.032019","2401:4900:32b3:30df:159e:27ba:5143:dbb6","2a03:90c0:5a1:2801::62","TCP","86","40472  >  80 [ACK] Seq=1 Ack=8968 Win=210 Len=0 TSval=471866792 TSecr=3839641516"
"21","0.032177","2a03:90c0:5a1:2801::62","2401:4900:32b3:30df:159e:27ba:5143:dbb6","HTTP","1367","Continuation"
"22","0.032177","2a03:90c0:5a1:2801::62","2401:4900:32b3:30df:159e:27ba:5143:dbb6","HTTP","1367","Continuation"
"23","0.032229","2401:4900:32b3:30df:159e:27ba:5143:dbb6","2a03:90c0:5a1:2801::62","TCP","86","40473  >  80 [ACK] Seq=1 Ack=8968 Win=194 Len=0 TSval=471866792 TSecr=1306369285"
"24","0.032855","2a03:90c0:5a1:2801::62","2401:4900:32b3:30df:159e:27ba:5143:dbb6","HTTP","1367","Continuation"
"25","0.032912","2401:4900:32b3:30df:159e:27ba:5143:dbb6","2a03:90c0:5a1:2801::62","TCP","86","40473  >  80 [ACK] Seq=1 Ack=10249 Win=194 Len=0 TSval=471866793 TSecr=1306369291"
"26","0.051002","2a03:90c0:5a1:2801::62","2401:4900:32b3:30df:159e:27ba:5143:dbb6","HTTP","1367","Continuation"
"27","0.051002","2a03:90c0:5a1:2801::62","2401:4900:32b3:30df:159e:27ba:5143:dbb6","HTTP","1367","Continuation"
"28","0.051454","2a03:90c0:5a1:2801::62","2401:4900:32b3:30df:159e:27ba:5143:dbb6","HTTP","1367","Continuation"
"29","0.051454","2a03:90c0:5a1:2801::62","2401:4900:32b3:30df:159e:27ba:5143:dbb6","HTTP","1367","Continuation"
"30","0.051604","2401:4900:32b3:30df:159e:27ba:5143:dbb6","2a03:90c0:5a1:2801::62","TCP","86","40473  >  80 [ACK] Seq=1 Ack=12811 Win=194 Len=0 TSval=471866811 TSecr=1306369305"
"31","0.051644","2401:4900:32b3:30df:159e:27ba:5143:dbb6","2a03:90c0:5a1:2801::62","TCP","86","40472  >  80 [ACK] Seq=1 Ack=11530 Win=210 Len=0 TSval=471866811 TSecr=3839641525"
"32","0.051686","2a03:90c0:5a1:2801::62","2401:4900:32b3:30df:159e:27ba:5143:dbb6","HTTP","1367","Continuation"
"33","0.051686","2a03:90c0:5a1:2801::62","2401:4900:32b3:30df:159e:27ba:5143:dbb6","HTTP","1367","Continuation"
"34","0.051715","2401:4900:32b3:30df:159e:27ba:5143:dbb6","2a03:90c0:5a1:2801::62","TCP","86","40472  >  80 [ACK] Seq=1 Ack=14092 Win=210 Len=0 TSval=471866811 TSecr=3839641534"
"35","0.051979","2a03:90c0:5a1:2801::62","2401:4900:32b3:30df:159e:27ba:5143:dbb6","HTTP","1367","Continuation"
"36","0.055296","2a03:90c0:5a1:2801::62","2401:4900:32b3:30df:159e:27ba:5143:dbb6","HTTP","1367","Continuation"
"37","0.055399","2401:4900:32b3:30df:159e:27ba:5143:dbb6","2a03:90c0:5a1:2801::62","TCP","86","40472  >  80 [ACK] Seq=1 Ack=16654 Win=210 Len=0 TSval=471866815 TSecr=3839641543"
"38","0.060507","2a03:90c0:5a1:2801::62","2401:4900:32b3:30df:159e:27ba:5143:dbb6","HTTP","1367","Continuation"
"39","0.060507","2a03:90c0:5a1:2801::62","2401:4900:32b3:30df:159e:27ba:5143:dbb6","HTTP","1367","Continuation"
"40","0.060580","2401:4900:32b3:30df:159e:27ba:5143:dbb6","2a03:90c0:5a1:2801::62","TCP","86","40472  >  80 [ACK] Seq=1 Ack=19216 Win=210 Len=0 TSval=471866820 TSecr=3839641552"
"41","0.065209","2a03:90c0:5a1:2801::62","2401:4900:32b3:30df:159e:27ba:5143:dbb6","HTTP","1367","Continuation"
"42","0.067567","2a03:90c0:5a1:2801::62","2401:4900:32b3:30df:159e:27ba:5143:dbb6","HTTP","1367","Continuation"
"43","0.067567","2a03:90c0:5a1:2801::62","2401:4900:32b3:30df:159e:27ba:5143:dbb6","HTTP","1367","Continuation"
"44","0.067680","2401:4900:32b3:30df:159e:27ba:5143:dbb6","2a03:90c0:5a1:2801::62","TCP","86","40473  >  80 [ACK] Seq=1 Ack=16654 Win=194 Len=0 TSval=471866827 TSecr=1306369335"
"45","0.067747","2a03:90c0:5a1:2801::62","2401:4900:32b3:30df:159e:27ba:5143:dbb6","HTTP","1367","Continuation"
"46","0.067775","2401:4900:32b3:30df:159e:27ba:5143:dbb6","2a03:90c0:5a1:2801::62","TCP","86","40473  >  80 [ACK] Seq=1 Ack=17935 Win=194 Len=0 TSval=471866827 TSecr=1306369338"
"47","0.090821","2a03:90c0:5a1:2801::62","2401:4900:32b3:30df:159e:27ba:5143:dbb6","HTTP","1367","Continuation"
"48","0.091127","2a03:90c0:5a1:2801::62","2401:4900:32b3:30df:159e:27ba:5143:dbb6","HTTP","1367","Continuation"
"49","0.091176","2401:4900:32b3:30df:159e:27ba:5143:dbb6","2a03:90c0:5a1:2801::62","TCP","86","40472  >  80 [ACK] Seq=1 Ack=21778 Win=210 Len=0 TSval=471866851 TSecr=3839641565"
"50","0.091361","2a03:90c0:5a1:2801::62","2401:4900:32b3:30df:159e:27ba:5143:dbb6","HTTP","1367","Continuation"
"51","0.091468","2a03:90c0:5a1:2801::62","2401:4900:32b3:30df:159e:27ba:5143:dbb6","HTTP","1367","Continuation"
"52","0.091496","2401:4900:32b3:30df:159e:27ba:5143:dbb6","2a03:90c0:5a1:2801::62","TCP","86","40473  >  80 [ACK] Seq=1 Ack=20497 Win=194 Len=0 TSval=471866851 TSecr=1306369345"
"53","0.091637","2a03:90c0:5a1:2801::62","2401:4900:32b3:30df:159e:27ba:5143:dbb6","HTTP","1367","Continuation"
"54","0.091738","2a03:90c0:5a1:2801::62","2401:4900:32b3:30df:159e:27ba:5143:dbb6","HTTP","1367","Continuation"
"55","0.091789","2401:4900:32b3:30df:159e:27ba:5143:dbb6","2a03:90c0:5a1:2801::62","TCP","86","40472  >  80 [ACK] Seq=1 Ack=24340 Win=210 Len=0 TSval=471866851 TSecr=3839641570"
"56","0.091866","2a03:90c0:5a1:2801::62","2401:4900:32b3:30df:159e:27ba:5143:dbb6","HTTP","1367","Continuation"
"57","0.091991","2a03:90c0:5a1:2801::62","2401:4900:32b3:30df:159e:27ba:5143:dbb6","HTTP","1367","Continuation"
"58","0.092028","2401:4900:32b3:30df:159e:27ba:5143:dbb6","2a03:90c0:5a1:2801::62","TCP","86","40472  >  80 [ACK] Seq=1 Ack=26902 Win=210 Len=0 TSval=471866852 TSecr=3839641580"
"59","0.126928","2a03:90c0:5a1:2801::62","2401:4900:32b3:30df:159e:27ba:5143:dbb6","HTTP","1367","Continuation"
"60","0.126928","2a03:90c0:5a1:2801::62","2401:4900:32b3:30df:159e:27ba:5143:dbb6","HTTP","1367","Continuation"
"61","0.126998","2401:4900:32b3:30df:159e:27ba:5143:dbb6","2a03:90c0:5a1:2801::62","TCP","86","40472  >  80 [ACK] Seq=1 Ack=29464 Win=210 Len=0 TSval=471866887 TSecr=3839641615"
"62","0.134742","2a03:90c0:5a1:2801::62","2401:4900:32b3:30df:159e:27ba:5143:dbb6","HTTP","1367","Continuation"
"63","0.134742","2a03:90c0:5a1:2801::62","2401:4900:32b3:30df:159e:27ba:5143:dbb6","HTTP","1367","Continuation"
"64","0.134852","2401:4900:32b3:30df:159e:27ba:5143:dbb6","2a03:90c0:5a1:2801::62","TCP","86","40472  >  80 [ACK] Seq=1 Ack=32026 Win=210 Len=0 TSval=471866895 TSecr=3839641625"
"65","0.135041","2a03:90c0:5a1:2801::62","2401:4900:32b3:30df:159e:27ba:5143:dbb6","HTTP","1367","Continuation"
"66","0.135041","2a03:90c0:5a1:2801::62","2401:4900:32b3:30df:159e:27ba:5143:dbb6","HTTP","1367","Continuation"
"67","0.135041","2a03:90c0:5a1:2801::62","2401:4900:32b3:30df:159e:27ba:5143:dbb6","HTTP","1367","Continuation"
"68","0.135102","2401:4900:32b3:30df:159e:27ba:5143:dbb6","2a03:90c0:5a1:2801::62","TCP","86","40473  >  80 [ACK] Seq=1 Ack=24340 Win=194 Len=0 TSval=471866895 TSecr=1306369408"
"69","0.139061","2a03:90c0:5a1:2801::62","2401:4900:32b3:30df:159e:27ba:5143:dbb6","HTTP","1367","Continuation"
"70","0.139147","2401:4900:32b3:30df:159e:27ba:5143:dbb6","2a03:90c0:5a1:2801::62","TCP","86","40473  >  80 [ACK] Seq=1 Ack=25621 Win=194 Len=0 TSval=471866899 TSecr=1306369408"
"71","0.147440","2a03:90c0:5a1:2801::62","2401:4900:32b3:30df:159e:27ba:5143:dbb6","HTTP","1367","Continuation"
"72","0.149252","2a03:90c0:5a1:2801::62","2401:4900:32b3:30df:159e:27ba:5143:dbb6","HTTP","1367","Continuation"
"73","0.149329","2401:4900:32b3:30df:159e:27ba:5143:dbb6","2a03:90c0:5a1:2801::62","TCP","86","40473  >  80 [ACK] Seq=1 Ack=28183 Win=194 Len=0 TSval=471866909 TSecr=1306369418"
"74","0.159815","2a03:90c0:5a1:2801::62","2401:4900:32b3:30df:159e:27ba:5143:dbb6","HTTP","1367","Continuation"
"75","0.159815","2a03:90c0:5a1:2801::62","2401:4900:32b3:30df:159e:27ba:5143:dbb6","HTTP","1367","Continuation"
"76","0.159920","2401:4900:32b3:30df:159e:27ba:5143:dbb6","2a03:90c0:5a1:2801::62","TCP","86","40473  >  80 [ACK] Seq=1 Ack=30745 Win=194 Len=0 TSval=471866920 TSecr=1306369428"
"77","0.179205","2a03:90c0:5a1:2801::62","2401:4900:32b3:30df:159e:27ba:5143:dbb6","HTTP","1367","Continuation"
"78","0.179205","2a03:90c0:5a1:2801::62","2401:4900:32b3:30df:159e:27ba:5143:dbb6","HTTP","1367","Continuation"
"79","0.179276","2401:4900:32b3:30df:159e:27ba:5143:dbb6","2a03:90c0:5a1:2801::62","TCP","86","40472  >  80 [ACK] Seq=1 Ack=34588 Win=210 Len=0 TSval=471866939 TSecr=3839641655"
"80","0.179448","2a03:90c0:5a1:2801::62","2401:4900:32b3:30df:159e:27ba:5143:dbb6","HTTP","1367","Continuation"
"81","0.179448","2a03:90c0:5a1:2801::62","2401:4900:32b3:30df:159e:27ba:5143:dbb6","HTTP","1367","Continuation"
"82","0.179475","2401:4900:32b3:30df:159e:27ba:5143:dbb6","2a03:90c0:5a1:2801::62","TCP","86","40472  >  80 [ACK] Seq=1 Ack=37150 Win=210 Len=0 TSval=471866939 TSecr=3839641665"
"83","0.180299","2a03:90c0:5a1:2801::62","2401:4900:32b3:30df:159e:27ba:5143:dbb6","HTTP","1367","Continuation"
"84","0.180554","2a03:90c0:5a1:2801::62","2401:4900:32b3:30df:159e:27ba:5143:dbb6","HTTP","1367","Continuation"
"85","0.180600","2401:4900:32b3:30df:159e:27ba:5143:dbb6","2a03:90c0:5a1:2801::62","TCP","86","40473  >  80 [ACK] Seq=1 Ack=33307 Win=194 Len=0 TSval=471866940 TSecr=1306369439"
"86","0.193274","2a03:90c0:5a1:2801::62","2401:4900:32b3:30df:159e:27ba:5143:dbb6","HTTP","1367","Continuation"
"87","0.193478","2a03:90c0:5a1:2801::62","2401:4900:32b3:30df:159e:27ba:5143:dbb6","HTTP","1367","Continuation"
"88","0.193517","2401:4900:32b3:30df:159e:27ba:5143:dbb6","2a03:90c0:5a1:2801::62","TCP","86","40472  >  80 [ACK] Seq=1 Ack=39712 Win=210 Len=0 TSval=471866953 TSecr=3839641670"
"89","0.193744","2a03:90c0:5a1:2801::62","2401:4900:32b3:30df:159e:27ba:5143:dbb6","HTTP","1367","Continuation"
"90","0.194380","2a03:90c0:5a1:2801::62","2401:4900:32b3:30df:159e:27ba:5143:dbb6","HTTP","1367","Continuation"
"91","0.194414","2401:4900:32b3:30df:159e:27ba:5143:dbb6","2a03:90c0:5a1:2801::62","TCP","86","40473  >  80 [ACK] Seq=1 Ack=35869 Win=194 Len=0 TSval=471866954 TSecr=1306369449"
"92","0.196643","2a03:90c0:5a1:2801::62","2401:4900:32b3:30df:159e:27ba:5143:dbb6","HTTP","1367","Continuation"
"93","0.196961","2a03:90c0:5a1:2801::62","2401:4900:32b3:30df:159e:27ba:5143:dbb6","HTTP","1367","Continuation"
"94","0.196961","2a03:90c0:5a1:2801::62","2401:4900:32b3:30df:159e:27ba:5143:dbb6","HTTP","1367","Continuation"
"95","0.197021","2401:4900:32b3:30df:159e:27ba:5143:dbb6","2a03:90c0:5a1:2801::62","TCP","86","40473  >  80 [ACK] Seq=1 Ack=38431 Win=194 Len=0 TSval=471866957 TSecr=1306369459"
"96","0.197382","2a03:90c0:5a1:2801::62","2401:4900:32b3:30df:159e:27ba:5143:dbb6","HTTP","1367","Continuation"
"97","0.197427","2401:4900:32b3:30df:159e:27ba:5143:dbb6","2a03:90c0:5a1:2801::62","TCP","86","40472  >  80 [ACK] Seq=1 Ack=42274 Win=210 Len=0 TSval=471866957 TSecr=3839641679"
"98","0.209103","2a03:90c0:5a1:2801::62","2401:4900:32b3:30df:159e:27ba:5143:dbb6","HTTP","1367","Continuation"
"99","0.214163","2a03:90c0:5a1:2801::62","2401:4900:32b3:30df:159e:27ba:5143:dbb6","HTTP","1367","Continuation"
"100","0.214220","2401:4900:32b3:30df:159e:27ba:5143:dbb6","2a03:90c0:5a1:2801::62","TCP","86","40472  >  80 [ACK] Seq=1 Ack=44836 Win=215 Len=0 TSval=471866974 TSecr=3839641688"
"101","0.214337","2a03:90c0:5a1:2801::62","2401:4900:32b3:30df:159e:27ba:5143:dbb6","HTTP","1367","Continuation"
"102","0.215275","2a03:90c0:5a1:2801::62","2401:4900:32b3:30df:159e:27ba:5143:dbb6","HTTP","1367","Continuation"
"103","0.215332","2401:4900:32b3:30df:159e:27ba:5143:dbb6","2a03:90c0:5a1:2801::62","TCP","86","40473  >  80 [ACK] Seq=1 Ack=40993 Win=194 Len=0 TSval=471866975 TSecr=1306369469"
"104","0.215391","2a03:90c0:5a1:2801::62","2401:4900:32b3:30df:159e:27ba:5143:dbb6","HTTP","1367","Continuation"
"105","0.219186","2a03:90c0:5a1:2801::62","2401:4900:32b3:30df:159e:27ba:5143:dbb6","HTTP","1367","Continuation"
"106","0.219280","2401:4900:32b3:30df:159e:27ba:5143:dbb6","2a03:90c0:5a1:2801::62","TCP","86","40472  >  80 [ACK] Seq=1 Ack=47398 Win=215 Len=0 TSval=471866979 TSecr=3839641697"
"107","0.219388","2a03:90c0:5a1:2801::62","2401:4900:32b3:30df:159e:27ba:5143:dbb6","HTTP","1367","Continuation"
"108","0.220039","2a03:90c0:5a1:2801::62","2401:4900:32b3:30df:159e:27ba:5143:dbb6","HTTP","1367","Continuation"
"109","0.220113","2401:4900:32b3:30df:159e:27ba:5143:dbb6","2a03:90c0:5a1:2801::62","TCP","86","40473  >  80 [ACK] Seq=1 Ack=43555 Win=194 Len=0 TSval=471866980 TSecr=1306369479"
"110","0.230357","2a03:90c0:5a1:2801::62","2401:4900:32b3:30df:159e:27ba:5143:dbb6","HTTP","1367","Continuation"
"111","0.230605","2a03:90c0:5a1:2801::62","2401:4900:32b3:30df:159e:27ba:5143:dbb6","HTTP","1367","Continuation"
"112","0.230849","2a03:90c0:5a1:2801::62","2401:4900:32b3:30df:159e:27ba:5143:dbb6","HTTP","1367","Continuation"
"113","0.230849","2a03:90c0:5a1:2801::62","2401:4900:32b3:30df:159e:27ba:5143:dbb6","HTTP","1367","Continuation"
"114","0.230915","2401:4900:32b3:30df:159e:27ba:5143:dbb6","2a03:90c0:5a1:2801::62","TCP","86","40473  >  80 [ACK] Seq=1 Ack=46117 Win=199 Len=0 TSval=471866991 TSecr=1306369489"
"115","0.230940","2401:4900:32b3:30df:159e:27ba:5143:dbb6","2a03:90c0:5a1:2801::62","TCP","86","40472  >  80 [ACK] Seq=1 Ack=49960 Win=215 Len=0 TSval=471866991 TSecr=3839641706"
"116","0.231315","2a03:90c0:5a1:2801::62","2401:4900:32b3:30df:159e:27ba:5143:dbb6","HTTP","1367","Continuation"
"117","0.239527","2a03:90c0:5a1:2801::62","2401:4900:32b3:30df:159e:27ba:5143:dbb6","HTTP","1367","Continuation"
"118","0.239527","2a03:90c0:5a1:2801::62","2401:4900:32b3:30df:159e:27ba:5143:dbb6","HTTP","1367","Continuation"
"119","0.239620","2401:4900:32b3:30df:159e:27ba:5143:dbb6","2a03:90c0:5a1:2801::62","TCP","86","40472  >  80 [ACK] Seq=1 Ack=52522 Win=215 Len=0 TSval=471866999 TSecr=3839641715"
"120","0.239966","2a03:90c0:5a1:2801::62","2401:4900:32b3:30df:159e:27ba:5143:dbb6","HTTP","1367","Continuation"
"121","0.239966","2a03:90c0:5a1:2801::62","2401:4900:32b3:30df:159e:27ba:5143:dbb6","HTTP","1367","Continuation"
"122","0.240041","2401:4900:32b3:30df:159e:27ba:5143:dbb6","2a03:90c0:5a1:2801::62","TCP","86","40473  >  80 [ACK] Seq=1 Ack=49960 Win=199 Len=0 TSval=471867000 TSecr=1306369499"
"123","0.240395","2a03:90c0:5a1:2801::62","2401:4900:32b3:30df:159e:27ba:5143:dbb6","HTTP","1367","Continuation"
"124","0.240395","2a03:90c0:5a1:2801::62","2401:4900:32b3:30df:159e:27ba:5143:dbb6","HTTP","1367","Continuation"
"125","0.240467","2401:4900:32b3:30df:159e:27ba:5143:dbb6","2a03:90c0:5a1:2801::62","TCP","86","40472  >  80 [ACK] Seq=1 Ack=55084 Win=215 Len=0 TSval=471867000 TSecr=3839641724"
"126","0.244812","2a03:90c0:5a1:2801::62","2401:4900:32b3:30df:159e:27ba:5143:dbb6","HTTP","1367","Continuation"
"127","0.244812","2a03:90c0:5a1:2801::62","2401:4900:32b3:30df:159e:27ba:5143:dbb6","HTTP","1367","Continuation"
"128","0.244862","2401:4900:32b3:30df:159e:27ba:5143:dbb6","2a03:90c0:5a1:2801::62","TCP","86","40472  >  80 [ACK] Seq=1 Ack=57646 Win=215 Len=0 TSval=471867005 TSecr=3839641735"
"129","0.245213","2a03:90c0:5a1:2801::62","2401:4900:32b3:30df:159e:27ba:5143:dbb6","HTTP","1367","Continuation"
"130","0.245213","2a03:90c0:5a1:2801::62","2401:4900:32b3:30df:159e:27ba:5143:dbb6","HTTP","1367","Continuation"
"131","0.245256","2401:4900:32b3:30df:159e:27ba:5143:dbb6","2a03:90c0:5a1:2801::62","TCP","86","40473  >  80 [ACK] Seq=1 Ack=52522 Win=199 Len=0 TSval=471867005 TSecr=1306369514"
"132","0.251182","2a03:90c0:5a1:2801::62","2401:4900:32b3:30df:159e:27ba:5143:dbb6","HTTP","1367","Continuation"
"133","0.251182","2a03:90c0:5a1:2801::62","2401:4900:32b3:30df:159e:27ba:5143:dbb6","HTTP","1367","Continuation"
"134","0.251340","2401:4900:32b3:30df:159e:27ba:5143:dbb6","2a03:90c0:5a1:2801::62","TCP","86","40473  >  80 [ACK] Seq=1 Ack=53803 Win=199 Len=0 TSval=471867011 TSecr=1306369524"
"135","0.251502","2a03:90c0:5a1:2801::62","2401:4900:32b3:30df:159e:27ba:5143:dbb6","HTTP","1367","Continuation"
"136","0.251538","2401:4900:32b3:30df:159e:27ba:5143:dbb6","2a03:90c0:5a1:2801::62","TCP","86","40472  >  80 [ACK] Seq=1 Ack=60208 Win=215 Len=0 TSval=471867011 TSecr=3839641741"
"137","0.257431","2a03:90c0:5a1:2801::62","2401:4900:32b3:30df:159e:27ba:5143:dbb6","HTTP","1367","Continuation"
"138","0.260712","2a03:90c0:5a1:2801::62","2401:4900:32b3:30df:159e:27ba:5143:dbb6","HTTP","1367","Continuation"
"139","0.260712","2a03:90c0:5a1:2801::62","2401:4900:32b3:30df:159e:27ba:5143:dbb6","HTTP","1367","Continuation"
"140","0.260743","2401:4900:32b3:30df:159e:27ba:5143:dbb6","2a03:90c0:5a1:2801::62","TCP","86","40472  >  80 [ACK] Seq=1 Ack=62770 Win=215 Len=0 TSval=471867020 TSecr=3839641750"
"141","0.261898","2a03:90c0:5a1:2801::62","2401:4900:32b3:30df:159e:27ba:5143:dbb6","HTTP","1367","Continuation"
"142","0.261913","2401:4900:32b3:30df:159e:27ba:5143:dbb6","2a03:90c0:5a1:2801::62","TCP","86","40473  >  80 [ACK] Seq=1 Ack=56365 Win=199 Len=0 TSval=471867022 TSecr=1306369524"
"143","0.264732","2a03:90c0:5a1:2801::62","2401:4900:32b3:30df:159e:27ba:5143:dbb6","HTTP","1367","Continuation"
"144","0.269188","2a03:90c0:5a1:2801::62","2401:4900:32b3:30df:159e:27ba:5143:dbb6","HTTP","1367","Continuation"
"145","0.269188","2a03:90c0:5a1:2801::62","2401:4900:32b3:30df:159e:27ba:5143:dbb6","HTTP","1367","Continuation"
"146","0.269282","2401:4900:32b3:30df:159e:27ba:5143:dbb6","2a03:90c0:5a1:2801::62","TCP","86","40472  >  80 [ACK] Seq=1 Ack=65332 Win=215 Len=0 TSval=471867029 TSecr=3839641759"
"147","0.271530","2a03:90c0:5a1:2801::62","2401:4900:32b3:30df:159e:27ba:5143:dbb6","HTTP","1367","Continuation"
"148","0.271600","2401:4900:32b3:30df:159e:27ba:5143:dbb6","2a03:90c0:5a1:2801::62","TCP","86","40473  >  80 [ACK] Seq=1 Ack=58927 Win=199 Len=0 TSval=471867031 TSecr=1306369534"
"149","0.275505","2a03:90c0:5a1:2801::62","2401:4900:32b3:30df:159e:27ba:5143:dbb6","HTTP","1367","Continuation"
"150","0.276185","2a03:90c0:5a1:2801::62","2401:4900:32b3:30df:159e:27ba:5143:dbb6","HTTP","1367","Continuation"
"151","0.279306","2a03:90c0:5a1:2801::62","2401:4900:32b3:30df:159e:27ba:5143:dbb6","HTTP","1367","Continuation"
"152","0.279391","2401:4900:32b3:30df:159e:27ba:5143:dbb6","2a03:90c0:5a1:2801::62","TCP","86","40472  >  80 [ACK] Seq=1 Ack=67894 Win=215 Len=0 TSval=471867039 TSecr=3839641768"
"153","0.281176","2a03:90c0:5a1:2801::62","2401:4900:32b3:30df:159e:27ba:5143:dbb6","HTTP","1367","Continuation"
"154","0.281245","2401:4900:32b3:30df:159e:27ba:5143:dbb6","2a03:90c0:5a1:2801::62","TCP","86","40473  >  80 [ACK] Seq=1 Ack=61489 Win=199 Len=0 TSval=471867041 TSecr=1306369543"
"155","0.286192","2a03:90c0:5a1:2801::62","2401:4900:32b3:30df:159e:27ba:5143:dbb6","HTTP","1367","Continuation"
"156","0.286192","2a03:90c0:5a1:2801::62","2401:4900:32b3:30df:159e:27ba:5143:dbb6","HTTP","1367","Continuation"
"157","0.286192","2a03:90c0:5a1:2801::62","2401:4900:32b3:30df:159e:27ba:5143:dbb6","HTTP","1367","Continuation"
"158","0.286326","2401:4900:32b3:30df:159e:27ba:5143:dbb6","2a03:90c0:5a1:2801::62","TCP","86","40472  >  80 [ACK] Seq=1 Ack=70456 Win=215 Len=0 TSval=471867046 TSecr=3839641777"
"159","0.290517","2a03:90c0:5a1:2801::62","2401:4900:32b3:30df:159e:27ba:5143:dbb6","HTTP","1367","Continuation"
"160","0.290565","2401:4900:32b3:30df:159e:27ba:5143:dbb6","2a03:90c0:5a1:2801::62","TCP","86","40473  >  80 [ACK] Seq=1 Ack=64051 Win=199 Len=0 TSval=471867050 TSecr=1306369553"
"161","0.293310","2a03:90c0:5a1:2801::62","2401:4900:32b3:30df:159e:27ba:5143:dbb6","HTTP","1367","Continuation"
"162","0.312475","2a03:90c0:5a1:2801::62","2401:4900:32b3:30df:159e:27ba:5143:dbb6","HTTP","1367","Continuation"
"163","0.312475","2a03:90c0:5a1:2801::62","2401:4900:32b3:30df:159e:27ba:5143:dbb6","HTTP","1367","Continuation"
"164","0.312551","2401:4900:32b3:30df:159e:27ba:5143:dbb6","2a03:90c0:5a1:2801::62","TCP","86","40472  >  80 [ACK] Seq=1 Ack=73018 Win=215 Len=0 TSval=471867072 TSecr=3839641800"
"165","0.335130","2a03:90c0:5a1:2801::62","2401:4900:32b3:30df:159e:27ba:5143:dbb6","HTTP","1367","Continuation"
"166","0.335130","2a03:90c0:5a1:2801::62","2401:4900:32b3:30df:159e:27ba:5143:dbb6","HTTP","1367","Continuation"
"167","0.335231","2401:4900:32b3:30df:159e:27ba:5143:dbb6","2a03:90c0:5a1:2801::62","TCP","86","40473  >  80 [ACK] Seq=1 Ack=66613 Win=199 Len=0 TSval=471867095 TSecr=1306369562"
"168","0.335295","2a03:90c0:5a1:2801::62","2401:4900:32b3:30df:159e:27ba:5143:dbb6","HTTP","1367","Continuation"
"169","0.335295","2a03:90c0:5a1:2801::62","2401:4900:32b3:30df:159e:27ba:5143:dbb6","HTTP","1367","Continuation"
"170","0.335349","2401:4900:32b3:30df:159e:27ba:5143:dbb6","2a03:90c0:5a1:2801::62","TCP","86","40472  >  80 [ACK] Seq=1 Ack=75580 Win=215 Len=0 TSval=471867095 TSecr=3839641810"
"171","0.335402","2a03:90c0:5a1:2801::62","2401:4900:32b3:30df:159e:27ba:5143:dbb6","HTTP","1367","Continuation"
"172","0.339755","2a03:90c0:5a1:2801::62","2401:4900:32b3:30df:159e:27ba:5143:dbb6","HTTP","1367","Continuation"
"173","0.339755","2a03:90c0:5a1:2801::62","2401:4900:32b3:30df:159e:27ba:5143:dbb6","HTTP","1367","Continuation"
"174","0.339844","2401:4900:32b3:30df:159e:27ba:5143:dbb6","2a03:90c0:5a1:2801::62","TCP","86","40472  >  80 [ACK] Seq=1 Ack=79423 Win=215 Len=0 TSval=471867100 TSecr=3839641815"
"175","0.340038","2a03:90c0:5a1:2801::62","2401:4900:32b3:30df:159e:27ba:5143:dbb6","HTTP","1367","Continuation"
"176","0.340074","2401:4900:32b3:30df:159e:27ba:5143:dbb6","2a03:90c0:5a1:2801::62","TCP","86","40472  >  80 [ACK] Seq=1 Ack=80704 Win=215 Len=0 TSval=471867100 TSecr=3839641825"
"177","0.367172","2a03:90c0:5a1:2801::62","2401:4900:32b3:30df:159e:27ba:5143:dbb6","HTTP","1367","Continuation"
"178","0.367172","2a03:90c0:5a1:2801::62","2401:4900:32b3:30df:159e:27ba:5143:dbb6","HTTP","1367","Continuation"
"179","0.367272","2401:4900:32b3:30df:159e:27ba:5143:dbb6","2a03:90c0:5a1:2801::62","TCP","86","40473  >  80 [ACK] Seq=1 Ack=69175 Win=199 Len=0 TSval=471867127 TSecr=1306369590"
"180","0.367430","2a03:90c0:5a1:2801::62","2401:4900:32b3:30df:159e:27ba:5143:dbb6","HTTP","1367","Continuation"
"181","0.367430","2a03:90c0:5a1:2801::62","2401:4900:32b3:30df:159e:27ba:5143:dbb6","HTTP","1367","Continuation"
"182","0.367475","2401:4900:32b3:30df:159e:27ba:5143:dbb6","2a03:90c0:5a1:2801::62","TCP","86","40473  >  80 [ACK] Seq=1 Ack=71737 Win=199 Len=0 TSval=471867127 TSecr=1306369624"
"183","0.367899","2a03:90c0:5a1:2801::62","2401:4900:32b3:30df:159e:27ba:5143:dbb6","HTTP","1367","Continuation"
"184","0.367899","2a03:90c0:5a1:2801::62","2401:4900:32b3:30df:159e:27ba:5143:dbb6","HTTP","1367","Continuation"
"185","0.367899","2a03:90c0:5a1:2801::62","2401:4900:32b3:30df:159e:27ba:5143:dbb6","HTTP","1367","Continuation"
"186","0.367999","2401:4900:32b3:30df:159e:27ba:5143:dbb6","2a03:90c0:5a1:2801::62","TCP","86","40473  >  80 [ACK] Seq=1 Ack=74299 Win=199 Len=0 TSval=471867128 TSecr=1306369635"
"187","0.368025","2401:4900:32b3:30df:159e:27ba:5143:dbb6","2a03:90c0:5a1:2801::62","TCP","86","40472  >  80 [ACK] Seq=1 Ack=83266 Win=215 Len=0 TSval=471867128 TSecr=3839641840"
"188","0.381566","2a03:90c0:5a1:2801::62","2401:4900:32b3:30df:159e:27ba:5143:dbb6","HTTP","1367","Continuation"
"189","0.381566","2a03:90c0:5a1:2801::62","2401:4900:32b3:30df:159e:27ba:5143:dbb6","HTTP","1367","Continuation"
"190","0.381653","2401:4900:32b3:30df:159e:27ba:5143:dbb6","2a03:90c0:5a1:2801::62","TCP","86","40473  >  80 [ACK] Seq=1 Ack=76861 Win=199 Len=0 TSval=471867141 TSecr=1306369643"
"191","0.389337","2a03:90c0:5a1:2801::62","2401:4900:32b3:30df:159e:27ba:5143:dbb6","HTTP","1367","Continuation"
"192","0.410662","2a03:90c0:5a1:2801::62","2401:4900:32b3:30df:159e:27ba:5143:dbb6","HTTP","1367","Continuation"
"193","0.410662","2a03:90c0:5a1:2801::62","2401:4900:32b3:30df:159e:27ba:5143:dbb6","HTTP","1367","Continuation"
"194","0.410738","2401:4900:32b3:30df:159e:27ba:5143:dbb6","2a03:90c0:5a1:2801::62","TCP","86","40472  >  80 [ACK] Seq=1 Ack=85828 Win=215 Len=0 TSval=471867170 TSecr=3839641885"
"195","0.412300","2a03:90c0:5a1:2801::62","2401:4900:32b3:30df:159e:27ba:5143:dbb6","HTTP","1367","Continuation"
"196","0.412300","2a03:90c0:5a1:2801::62","2401:4900:32b3:30df:159e:27ba:5143:dbb6","HTTP","1367","Continuation"
"197","0.412356","2401:4900:32b3:30df:159e:27ba:5143:dbb6","2a03:90c0:5a1:2801::62","TCP","86","40473  >  80 [ACK] Seq=1 Ack=80704 Win=199 Len=0 TSval=471867172 TSecr=1306369643"
"198","0.412507","2a03:90c0:5a1:2801::62","2401:4900:32b3:30df:159e:27ba:5143:dbb6","HTTP","1367","Continuation"
"199","0.412507","2a03:90c0:5a1:2801::62","2401:4900:32b3:30df:159e:27ba:5143:dbb6","HTTP","1367","Continuation"
"200","0.412552","2401:4900:32b3:30df:159e:27ba:5143:dbb6","2a03:90c0:5a1:2801::62","TCP","86","40472  >  80 [ACK] Seq=1 Ack=88390 Win=215 Len=0 TSval=471867172 TSecr=3839641890"
"201","0.413236","2a03:90c0:5a1:2801::62","2401:4900:32b3:30df:159e:27ba:5143:dbb6","HTTP","1367","Continuation"
"202","0.413236","2a03:90c0:5a1:2801::62","2401:4900:32b3:30df:159e:27ba:5143:dbb6","HTTP","1367","Continuation"
"203","0.413280","2401:4900:32b3:30df:159e:27ba:5143:dbb6","2a03:90c0:5a1:2801::62","TCP","86","40472  >  80 [ACK] Seq=1 Ack=90952 Win=215 Len=0 TSval=471867173 TSecr=3839641899"
"204","0.413437","2a03:90c0:5a1:2801::62","2401:4900:32b3:30df:159e:27ba:5143:dbb6","HTTP","1367","Continuation"
"205","0.413437","2a03:90c0:5a1:2801::62","2401:4900:32b3:30df:159e:27ba:5143:dbb6","HTTP","1367","Continuation"
"206","0.413483","2401:4900:32b3:30df:159e:27ba:5143:dbb6","2a03:90c0:5a1:2801::62","TCP","86","40473  >  80 [ACK] Seq=1 Ack=83266 Win=199 Len=0 TSval=471867173 TSecr=1306369680"
"207","0.415550","2a03:90c0:5a1:2801::62","2401:4900:32b3:30df:159e:27ba:5143:dbb6","HTTP","1367","Continuation"
"208","0.415550","2a03:90c0:5a1:2801::62","2401:4900:32b3:30df:159e:27ba:5143:dbb6","HTTP","1367","Continuation"
"209","0.415550","2a03:90c0:5a1:2801::62","2401:4900:32b3:30df:159e:27ba:5143:dbb6","HTTP","1367","Continuation"
"210","0.415611","2401:4900:32b3:30df:159e:27ba:5143:dbb6","2a03:90c0:5a1:2801::62","TCP","86","40473  >  80 [ACK] Seq=1 Ack=85828 Win=199 Len=0 TSval=471867175 TSecr=1306369684"
"211","0.419829","2a03:90c0:5a1:2801::62","2401:4900:32b3:30df:159e:27ba:5143:dbb6","HTTP","1367","Continuation"
"212","0.419883","2401:4900:32b3:30df:159e:27ba:5143:dbb6","2a03:90c0:5a1:2801::62","TCP","86","40472  >  80 [ACK] Seq=1 Ack=93514 Win=215 Len=0 TSval=471867180 TSecr=3839641908"
"213","0.425178","2a03:90c0:5a1:2801::62","2401:4900:32b3:30df:159e:27ba:5143:dbb6","HTTP","1367","Continuation"
"214","0.425868","2a03:90c0:5a1:2801::62","2401:4900:32b3:30df:159e:27ba:5143:dbb6","HTTP","1367","Continuation"
"215","0.425922","2401:4900:32b3:30df:159e:27ba:5143:dbb6","2a03:90c0:5a1:2801::62","TCP","86","40472  >  80 [ACK] Seq=1 Ack=96076 Win=215 Len=0 TSval=471867186 TSecr=3839641916"
"216","0.429885","2a03:90c0:5a1:2801::62","2401:4900:32b3:30df:159e:27ba:5143:dbb6","HTTP","1367","Continuation"
"217","0.429953","2401:4900:32b3:30df:159e:27ba:5143:dbb6","2a03:90c0:5a1:2801::62","TCP","86","40473  >  80 [ACK] Seq=1 Ack=87109 Win=199 Len=0 TSval=471867190 TSecr=1306369700"
"218","0.430488","2a03:90c0:5a1:2801::62","2401:4900:32b3:30df:159e:27ba:5143:dbb6","HTTP","1367","Continuation"
"219","0.434249","2a03:90c0:5a1:2801::62","2401:4900:32b3:30df:159e:27ba:5143:dbb6","HTTP","1367","Continuation"
"220","0.434335","2401:4900:32b3:30df:159e:27ba:5143:dbb6","2a03:90c0:5a1:2801::62","TCP","86","40473  >  80 [ACK] Seq=1 Ack=89671 Win=199 Len=0 TSval=471867194 TSecr=1306369700"
"221","0.434508","2a03:90c0:5a1:2801::62","2401:4900:32b3:30df:159e:27ba:5143:dbb6","HTTP","1367","Continuation"
"222","0.434508","2a03:90c0:5a1:2801::62","2401:4900:32b3:30df:159e:27ba:5143:dbb6","HTTP","1367","Continuation"
"223","0.435441","2a03:90c0:5a1:2801::62","2401:4900:32b3:30df:159e:27ba:5143:dbb6","HTTP","1367","Continuation"
"224","0.435472","2401:4900:32b3:30df:159e:27ba:5143:dbb6","2a03:90c0:5a1:2801::62","TCP","86","40472  >  80 [ACK] Seq=1 Ack=98638 Win=215 Len=0 TSval=471867195 TSecr=3839641925"
"225","0.443382","2a03:90c0:5a1:2801::62","2401:4900:32b3:30df:159e:27ba:5143:dbb6","HTTP","1367","Continuation"
"226","0.443382","2a03:90c0:5a1:2801::62","2401:4900:32b3:30df:159e:27ba:5143:dbb6","HTTP","1367","Continuation"
"227","0.443434","2401:4900:32b3:30df:159e:27ba:5143:dbb6","2a03:90c0:5a1:2801::62","TCP","86","40473  >  80 [ACK] Seq=1 Ack=92233 Win=199 Len=0 TSval=471867203 TSecr=1306369704"
"228","0.443548","2a03:90c0:5a1:2801::62","2401:4900:32b3:30df:159e:27ba:5143:dbb6","HTTP","1367","Continuation"
"229","0.443568","2401:4900:32b3:30df:159e:27ba:5143:dbb6","2a03:90c0:5a1:2801::62","TCP","86","40472  >  80 [ACK] Seq=1 Ack=101200 Win=220 Len=0 TSval=471867203 TSecr=3839641934"
"230","0.444923","2a03:90c0:5a1:2801::62","2401:4900:32b3:30df:159e:27ba:5143:dbb6","HTTP","1367","Continuation"
"231","0.451582","2a03:90c0:5a1:2801::62","2401:4900:32b3:30df:159e:27ba:5143:dbb6","HTTP","1367","Continuation"
"232","0.451582","2a03:90c0:5a1:2801::62","2401:4900:32b3:30df:159e:27ba:5143:dbb6","HTTP","1367","Continuation"
"233","0.451631","2401:4900:32b3:30df:159e:27ba:5143:dbb6","2a03:90c0:5a1:2801::62","TCP","86","40473  >  80 [ACK] Seq=1 Ack=94795 Win=199 Len=0 TSval=471867211 TSecr=1306369715"
"234","0.451718","2a03:90c0:5a1:2801::62","2401:4900:32b3:30df:159e:27ba:5143:dbb6","HTTP","1367","Continuation"
"235","0.452590","2a03:90c0:5a1:2801::62","2401:4900:32b3:30df:159e:27ba:5143:dbb6","HTTP","1367","Continuation"
"236","0.452619","2401:4900:32b3:30df:159e:27ba:5143:dbb6","2a03:90c0:5a1:2801::62","TCP","86","40472  >  80 [ACK] Seq=1 Ack=103762 Win=220 Len=0 TSval=471867212 TSecr=3839641943"
"237","0.460661","2a03:90c0:5a1:2801::62","2401:4900:32b3:30df:159e:27ba:5143:dbb6","HTTP","1367","Continuation"
"238","0.460661","2a03:90c0:5a1:2801::62","2401:4900:32b3:30df:159e:27ba:5143:dbb6","HTTP","1367","Continuation"
"239","0.460703","2401:4900:32b3:30df:159e:27ba:5143:dbb6","2a03:90c0:5a1:2801::62","TCP","86","40472  >  80 [ACK] Seq=1 Ack=106324 Win=220 Len=0 TSval=471867220 TSecr=3839641952"
"240","0.463455","2a03:90c0:5a1:2801::62","2401:4900:32b3:30df:159e:27ba:5143:dbb6","HTTP","1367","Continuation"
"241","0.463520","2401:4900:32b3:30df:159e:27ba:5143:dbb6","2a03:90c0:5a1:2801::62","TCP","86","40473  >  80 [ACK] Seq=1 Ack=97357 Win=199 Len=0 TSval=471867223 TSecr=1306369723"
"242","0.463986","2a03:90c0:5a1:2801::62","2401:4900:32b3:30df:159e:27ba:5143:dbb6","HTTP","1367","Continuation"
"243","0.465750","2a03:90c0:5a1:2801::62","2401:4900:32b3:30df:159e:27ba:5143:dbb6","HTTP","1367","Continuation"
"244","0.465792","2401:4900:32b3:30df:159e:27ba:5143:dbb6","2a03:90c0:5a1:2801::62","TCP","86","40473  >  80 [ACK] Seq=1 Ack=99919 Win=204 Len=0 TSval=471867225 TSecr=1306369736"
"245","0.469145","2a03:90c0:5a1:2801::62","2401:4900:32b3:30df:159e:27ba:5143:dbb6","HTTP","1367","Continuation"
"246","0.470850","2a03:90c0:5a1:2801::62","2401:4900:32b3:30df:159e:27ba:5143:dbb6","HTTP","1367","Continuation"
"247","0.470898","2401:4900:32b3:30df:159e:27ba:5143:dbb6","2a03:90c0:5a1:2801::62","TCP","86","40472  >  80 [ACK] Seq=1 Ack=108886 Win=220 Len=0 TSval=471867231 TSecr=3839641961"
"248","0.475670","2a03:90c0:5a1:2801::62","2401:4900:32b3:30df:159e:27ba:5143:dbb6","HTTP","1367","Continuation"
"249","0.477082","2a03:90c0:5a1:2801::62","2401:4900:32b3:30df:159e:27ba:5143:dbb6","HTTP","1367","Continuation"
"250","0.477082","2a03:90c0:5a1:2801::62","2401:4900:32b3:30df:159e:27ba:5143:dbb6","HTTP","1367","Continuation"
"251","0.477132","2401:4900:32b3:30df:159e:27ba:5143:dbb6","2a03:90c0:5a1:2801::62","TCP","86","40473  >  80 [ACK] Seq=1 Ack=102481 Win=204 Len=0 TSval=471867237 TSecr=1306369745"
"252","0.480527","2a03:90c0:5a1:2801::62","2401:4900:32b3:30df:159e:27ba:5143:dbb6","HTTP","1367","Continuation"
"253","0.480564","2401:4900:32b3:30df:159e:27ba:5143:dbb6","2a03:90c0:5a1:2801::62","TCP","86","40472  >  80 [ACK] Seq=1 Ack=111448 Win=220 Len=0 TSval=471867240 TSecr=3839641970"
"254","0.484450","2a03:90c0:5a1:2801::62","2401:4900:32b3:30df:159e:27ba:5143:dbb6","HTTP","1367","Continuation"
"255","0.484726","2a03:90c0:5a1:2801::62","2401:4900:32b3:30df:159e:27ba:5143:dbb6","HTTP","1367","Continuation"
"256","0.484765","2401:4900:32b3:30df:159e:27ba:5143:dbb6","2a03:90c0:5a1:2801::62","TCP","86","40473  >  80 [ACK] Seq=1 Ack=105043 Win=204 Len=0 TSval=471867244 TSecr=1306369754"
"257","0.486651","2a03:90c0:5a1:2801::62","2401:4900:32b3:30df:159e:27ba:5143:dbb6","HTTP","1367","Continuation"
"258","0.489191","2a03:90c0:5a1:2801::62","2401:4900:32b3:30df:159e:27ba:5143:dbb6","HTTP","1367","Continuation"
"259","0.489225","2401:4900:32b3:30df:159e:27ba:5143:dbb6","2a03:90c0:5a1:2801::62","TCP","86","40472  >  80 [ACK] Seq=1 Ack=114010 Win=220 Len=0 TSval=471867249 TSecr=3839641979"
"260","0.490925","2a03:90c0:5a1:2801::62","2401:4900:32b3:30df:159e:27ba:5143:dbb6","HTTP","1367","Continuation"
"261","0.492904","2a03:90c0:5a1:2801::62","2401:4900:32b3:30df:159e:27ba:5143:dbb6","HTTP","1367","Continuation"
"262","0.492989","2401:4900:32b3:30df:159e:27ba:5143:dbb6","2a03:90c0:5a1:2801::62","TCP","86","40473  >  80 [ACK] Seq=1 Ack=107605 Win=204 Len=0 TSval=471867253 TSecr=1306369763"
"263","0.495401","2a03:90c0:5a1:2801::62","2401:4900:32b3:30df:159e:27ba:5143:dbb6","HTTP","1367","Continuation"
"264","0.497812","2a03:90c0:5a1:2801::62","2401:4900:32b3:30df:159e:27ba:5143:dbb6","HTTP","1367","Continuation"
"265","0.497875","2401:4900:32b3:30df:159e:27ba:5143:dbb6","2a03:90c0:5a1:2801::62","TCP","86","40472  >  80 [ACK] Seq=1 Ack=116572 Win=220 Len=0 TSval=471867258 TSecr=3839641988"
"266","0.502208","2a03:90c0:5a1:2801::62","2401:4900:32b3:30df:159e:27ba:5143:dbb6","HTTP","1367","Continuation"
"267","0.505124","2a03:90c0:5a1:2801::62","2401:4900:32b3:30df:159e:27ba:5143:dbb6","HTTP","1367","Continuation"
"268","0.505211","2401:4900:32b3:30df:159e:27ba:5143:dbb6","2a03:90c0:5a1:2801::62","TCP","86","40473  >  80 [ACK] Seq=1 Ack=110167 Win=204 Len=0 TSval=471867265 TSecr=1306369772"
"269","0.505372","2a03:90c0:5a1:2801::62","2401:4900:32b3:30df:159e:27ba:5143:dbb6","HTTP","1367","Continuation"
"270","0.505372","2a03:90c0:5a1:2801::62","2401:4900:32b3:30df:159e:27ba:5143:dbb6","HTTP","1367","Continuation"
"271","0.505412","2401:4900:32b3:30df:159e:27ba:5143:dbb6","2a03:90c0:5a1:2801::62","TCP","86","40472  >  80 [ACK] Seq=1 Ack=119134 Win=220 Len=0 TSval=471867265 TSecr=3839641996"
"272","0.510300","2a03:90c0:5a1:2801::62","2401:4900:32b3:30df:159e:27ba:5143:dbb6","HTTP","1367","Continuation"
"273","0.513332","2a03:90c0:5a1:2801::62","2401:4900:32b3:30df:159e:27ba:5143:dbb6","HTTP","1367","Continuation"
"274","0.513373","2401:4900:32b3:30df:159e:27ba:5143:dbb6","2a03:90c0:5a1:2801::62","TCP","86","40473  >  80 [ACK] Seq=1 Ack=112729 Win=204 Len=0 TSval=471867273 TSecr=1306369781"
"275","0.513649","2a03:90c0:5a1:2801::62","2401:4900:32b3:30df:159e:27ba:5143:dbb6","HTTP","1367","Continuation"
"276","0.513649","2a03:90c0:5a1:2801::62","2401:4900:32b3:30df:159e:27ba:5143:dbb6","HTTP","1367","Continuation"
"277","0.513672","2401:4900:32b3:30df:159e:27ba:5143:dbb6","2a03:90c0:5a1:2801::62","TCP","86","40472  >  80 [ACK] Seq=1 Ack=121696 Win=220 Len=0 TSval=471867273 TSecr=3839642005"
"278","0.523501","2a03:90c0:5a1:2801::62","2401:4900:32b3:30df:159e:27ba:5143:dbb6","HTTP","1367","Continuation"
"279","0.523719","2a03:90c0:5a1:2801::62","2401:4900:32b3:30df:159e:27ba:5143:dbb6","HTTP","1367","Continuation"
"280","0.523738","2401:4900:32b3:30df:159e:27ba:5143:dbb6","2a03:90c0:5a1:2801::62","TCP","86","40472  >  80 [ACK] Seq=1 Ack=124258 Win=220 Len=0 TSval=471867283 TSecr=3839642014"
"281","0.533552","2a03:90c0:5a1:2801::62","2401:4900:32b3:30df:159e:27ba:5143:dbb6","HTTP","1367","Continuation"
"282","0.533833","2a03:90c0:5a1:2801::62","2401:4900:32b3:30df:159e:27ba:5143:dbb6","HTTP","1367","Continuation"
"283","0.533902","2401:4900:32b3:30df:159e:27ba:5143:dbb6","2a03:90c0:5a1:2801::62","TCP","86","40472  >  80 [ACK] Seq=1 Ack=126820 Win=220 Len=0 TSval=471867294 TSecr=3839642023"
"284","0.566325","2a03:90c0:5a1:2801::62","2401:4900:32b3:30df:159e:27ba:5143:dbb6","HTTP","1367","Continuation"
"285","0.566325","2a03:90c0:5a1:2801::62","2401:4900:32b3:30df:159e:27ba:5143:dbb6","HTTP","1367","Continuation"
"286","0.566528","2a03:90c0:5a1:2801::62","2401:4900:32b3:30df:159e:27ba:5143:dbb6","HTTP","1367","Continuation"
"287","0.566528","2a03:90c0:5a1:2801::62","2401:4900:32b3:30df:159e:27ba:5143:dbb6","HTTP","1367","Continuation"
"288","0.566528","2a03:90c0:5a1:2801::62","2401:4900:32b3:30df:159e:27ba:5143:dbb6","HTTP","1367","Continuation"
"289","0.566584","2401:4900:32b3:30df:159e:27ba:5143:dbb6","2a03:90c0:5a1:2801::62","TCP","86","40473  >  80 [ACK] Seq=1 Ack=115291 Win=204 Len=0 TSval=471867326 TSecr=1306369820"
"290","0.566601","2401:4900:32b3:30df:159e:27ba:5143:dbb6","2a03:90c0:5a1:2801::62","TCP","86","40472  >  80 [ACK] Seq=1 Ack=130663 Win=220 Len=0 TSval=471867326 TSecr=3839642040"
"291","0.569124","2a03:90c0:5a1:2801::62","2401:4900:32b3:30df:159e:27ba:5143:dbb6","HTTP","1367","Continuation"
"292","0.569195","2401:4900:32b3:30df:159e:27ba:5143:dbb6","2a03:90c0:5a1:2801::62","TCP","86","40472  >  80 [ACK] Seq=1 Ack=131944 Win=220 Len=0 TSval=471867329 TSecr=3839642045"
"293","0.569224","2a03:90c0:5a1:2801::62","2401:4900:32b3:30df:159e:27ba:5143:dbb6","HTTP","1367","Continuation"
"294","0.579303","2a03:90c0:5a1:2801::62","2401:4900:32b3:30df:159e:27ba:5143:dbb6","HTTP","1367","Continuation"
